	pair_index	n1	pp	n2	v1	v2/n3/adverb	condition	sentence	violIndex	pp_freq	n1_freq	n2_freq	v1_freq	v2/n3/adverb_freq	pp_nl	n1_nl	n2_nl	v1_nl	v2/n3/adverb_nl	violation_type
9	anim-anim	builders	by	athletes	prefer	knitting	GSLS_plur_syntactic	The builders by the athletes prefer knitting.	0	4703106084	5454568	4726603	20278168	2033048	2	8	8	6	8	syntactic
3	anim-anim	vets	by	plumber	detest	boxing	GSLD_C_plur_syntactic	The vets that the plumber detest pray.	1	4703106084	262330	734834	740903	2262574	2	4	7	6	6	syntactic
6	anim-inanim	lawyer	near	bus	leaks	suddenly	GDLS_sing_semantic	The lawyer near the bus leaks suddenly.	1	154954539	21493788	19370874	1935324	58025537	4	6	3	5	8	semantic
1	anim-anim	doctors	beside	pilots	fear	spinning	GSLS_C_plur_syntactic	The doctors that the pilots fear sit.	0	29718597	19521968	5455700	83025936	6978676	6	7	6	4	8	syntactic
8	inanim-anim	taxi	by	farmer	leaks	suddenly	GSLD_sing_semantic	The taxi by the farmer leaks suddenly.	0	4703106084	4478068	20568429	1935324	58025537	2	4	6	5	8	semantic
5	anim-inanim	doctor	beside	scooter	detests	skiing	GSLD_sing_semantic	The doctor beside the scooter detests skiing.	0	29718597	52110730	405037	181255	1934331	6	6	7	7	6	semantic
8	anim-anim	painters	by	athletes	detests	dancing	GDLD_plur_syntactic	The painters by the athletes detests dancing.	1	4703106084	7084827	4726603	181255	15565681	2	8	8	7	7	syntactic
7	anim-anim	plumbers	by	painter	hate	boxing	GSLD_plur_syntactic	The plumbers by the painter hate boxing.	0	4703106084	543869	13065194	16538862	2262574	2	8	7	4	6	syntactic
0	anim-anim	actor	near	pilot	likes	farming	GSLS_C_sing_syntactic	The actor that the pilot likes arrives.	0	154954539	14665285	16262831	9285296	15602571	4	5	5	5	7	syntactic
9	anim-anim	baker	beside	teacher	loves	climbing	GSLS_sing_syntactic	The baker beside the teacher loves climbing.	0	29718597	13610150	74147301	12028067	7755370	6	5	7	5	8	syntactic
7	anim-anim	chef	by	barber	avoid	climbing	GDLD_C_sing_syntactic	The chef that the barber avoid arrives.	1	4703106084	2470923	4668021	60713817	7755370	2	4	6	5	8	syntactic
5	anim-anim	lawyers	beside	builders	detest	painting	GSLS_C_plur_syntactic	The lawyers that the builders detest arrive.	0	29718597	15702570	5454568	740903	32738623	6	7	8	6	8	syntactic
7	inanim-inanim	truck	near	scooter	dislikes	cooking	GDLD_sing_semantic	The truck near the scooter dislikes cooking.	1	154954539	14274010	405037	1451937	13672366	4	5	7	8	7	semantic
4	anim-anim	builder	by	nurse	skids	loudly	GDLD_sing_semantic	The builder by the nurse skids loudly.	1	4703106084	4915470	23875250	250523	5998778	2	7	5	5	6	semantic
2	anim-anim	builders	beside	barber	hates	bowling	GDLS_C_plur_syntactic	The builders that the barber hates sit.	0	29718597	5454568	4668021	2416713	2476732	6	8	6	5	7	syntactic
3	inanim-anim	truck	by	waiter	dislikes	skiing	GDLS_sing_semantic	The truck by the waiter dislikes skiing.	1	4703106084	14274010	3340926	1451937	1934331	2	5	6	8	6	semantic
9	inanim-inanim	scooter	beside	bus	leaks	abruptly	GSLS_sing_semantic	The scooter beside the bus leaks abruptly.	0	29718597	405037	19370874	1935324	7262021	6	7	3	5	8	semantic
7	inanim-anim	trucks	near	judges	hate	painting	GDLS_plur_semantic	The trucks near the judges hate painting.	1	154954539	6808013	24677643	16538862	32738623	4	6	6	4	8	semantic
7	anim-anim	doctors	beside	chef	avoids	skiing	GDLS_C_plur_syntactic	The doctors that the chef avoids arrive.	0	29718597	19521968	2470923	3608938	1934331	6	7	4	6	6	syntactic
9	anim-anim	banker	beside	bakers	love	sailing	GDLS_C_sing_syntactic	The banker that the bakers love dies.	0	29718597	5135467	997597	210137973	8731451	6	6	6	4	7	syntactic
4	anim-anim	pilots	near	bankers	dislikes	yachting	GDLD_plur_syntactic	The pilots near the bankers dislikes yachting.	1	154954539	5455700	6179440	1451937	382785	4	6	7	8	8	syntactic
6	anim-anim	farmer	beside	teachers	prefers	climbing	GSLD_sing_syntactic	The farmer beside the teachers prefers climbing.	0	29718597	20568429	73279702	4149558	7755370	6	6	8	7	8	syntactic
2	anim-anim	nurse	beside	teacher	detests	knitting	GSLS_C_sing_syntactic	The nurse that the teacher detests sits.	0	29718597	23875250	74147301	181255	2033048	6	5	7	7	8	syntactic
6	anim-anim	teachers	by	actors	like	cycling	GSLS_plur_syntactic	The teachers by the actors like cycling.	0	4703106084	73279702	18120032	709849832	2334761	2	8	6	4	7	syntactic
6	anim-anim	builder	beside	athletes	fears	skating	GSLD_C_sing_syntactic	The builder that the athletes fears prays.	1	29718597	4915470	4726603	17721106	1784648	6	7	8	5	7	syntactic
9	inanim-inanim	taxis	beside	scooters	crash	noisily	GSLS_plur_semantic	The taxis beside the scooters crash noisily.	0	29718597	1073931	182717	6995312	807804	6	5	8	5	7	semantic
1	anim-anim	farmer	beside	plumbers	avoid	skating	GDLS_C_sing_syntactic	The farmer that the plumbers avoid dies.	0	29718597	20568429	543869	60713817	1784648	6	6	8	5	7	syntactic
1	anim-anim	judge	beside	lawyers	dislikes	sailing	GSLD_C_sing_syntactic	The judge that the lawyers dislikes sits.	1	29718597	63704000	15702570	1451937	8731451	6	5	7	8	7	syntactic
8	anim-anim	doctor	beside	plumbers	like	dancing	GDLS_sing_syntactic	The doctor beside the plumbers like dancing.	1	29718597	52110730	543869	709849832	15565681	6	6	8	4	7	syntactic
6	inanim-inanim	vans	beside	cars	like	boxing	GDLD_plur_semantic	The vans beside the cars like boxing.	1	29718597	963840	24371897	709849832	2262574	6	4	4	4	6	semantic
2	anim-inanim	dentists	by	scooters	leak	suddenly	GDLS_plur_semantic	The dentists by the scooters leak suddenly.	1	4703106084	1487700	182717	3272091	58025537	2	8	8	4	8	semantic
2	anim-anim	waiters	beside	vet	fear	cycling	GSLD_plur_syntactic	The waiters beside the vet fear cycling.	0	29718597	1363954	2597895	83025936	2334761	6	7	3	4	7	syntactic
7	anim-anim	bakers	by	doctors	prefer	shopping	GSLS_plur_semantic	The bakers by the doctors prefer shopping.	0	4703106084	997597	19521968	20278168	11206466	2	6	7	6	8	semantic
2	anim-anim	tailors	by	bankers	honk	twice	GDLD_plur_semantic	The tailors by the bankers honk twice.	1	4703106084	1121681	6179440	186601	36389658	2	7	7	4	5	semantic
2	anim-anim	barbers	beside	plumbers	likes	boxing	GDLD_C_plur_syntactic	The barbers that the plumbers likes arrive.	1	29718597	607437	543869	9285296	2262574	6	7	8	5	6	syntactic
1	anim-anim	banker	near	barber	hates	knitting	GSLS_sing_syntactic	The banker near the barber hates knitting.	0	154954539	5135467	4668021	2416713	2033048	4	6	6	5	8	syntactic
7	inanim-anim	vans	by	barbers	honk	noisily	GSLD_plur_semantic	The vans by the barbers honk noisily.	0	4703106084	963840	607437	186601	807804	2	4	7	4	7	semantic
2	anim-anim	dentist	beside	doctor	avoids	acting	GSLS_sing_semantic	The dentist beside the doctor avoids acting.	0	29718597	3198534	52110730	3608938	38536231	6	7	6	6	6	semantic
2	anim-anim	tailor	beside	nurse	detest	shopping	GDLD_C_sing_syntactic	The tailor that the nurse detest prays.	1	29718597	3371396	23875250	740903	11206466	6	6	5	6	8	syntactic
8	anim-inanim	barbers	by	taxis	like	spinning	GSLD_plur_semantic	The barbers by the taxis like spinning.	0	4703106084	607437	1073931	709849832	6978676	2	7	5	4	8	semantic
6	anim-anim	baker	beside	plumber	fear	climbing	GDLD_sing_syntactic	The baker beside the plumber fear climbing.	1	29718597	13610150	734834	83025936	7755370	6	5	7	4	8	syntactic
7	anim-anim	teachers	by	banker	avoids	studying	GDLS_plur_syntactic	The teachers by the banker avoids studying.	1	4703106084	73279702	5135467	3608938	19754110	2	8	6	6	8	syntactic
1	anim-anim	waiters	beside	vets	hates	farming	GDLD_C_plur_syntactic	The waiters that the vets hates die.	1	29718597	1363954	262330	2416713	15602571	6	7	4	5	7	syntactic
6	anim-anim	tailors	by	plumber	likes	sailing	GDLS_plur_syntactic	The tailors by the plumber likes sailing.	1	4703106084	1121681	734834	9285296	8731451	2	7	7	5	7	syntactic
8	anim-anim	dentists	beside	judge	dislike	climbing	GSLD_C_plur_syntactic	The dentists that the judge dislike arrive.	1	29718597	1487700	63704000	6703610	7755370	6	8	5	7	8	syntactic
0	anim-anim	lawyer	beside	painter	prefer	cycling	GDLD_sing_syntactic	The lawyer beside the painter prefer cycling.	1	29718597	21493788	13065194	20278168	2334761	6	6	7	6	7	syntactic
1	anim-anim	lawyer	beside	vets	avoids	studying	GSLD_sing_syntactic	The lawyer beside the vets avoids studying.	0	29718597	21493788	262330	3608938	19754110	6	6	4	6	8	syntactic
1	anim-anim	plumber	near	bakers	avoid	acting	GDLS_sing_syntactic	The plumber near the bakers avoid acting.	1	154954539	734834	997597	60713817	38536231	4	7	6	5	6	syntactic
