	pair_index	n1	pp	n2	v1	v2/n3/adverb	condition	sentence	violIndex	pp_freq	n1_freq	n2_freq	v1_freq	v2/n3/adverb_freq	pp_nl	n1_nl	n2_nl	v1_nl	v2/n3/adverb_nl	violation_type	n1_v1_freq	n2_v1_freq
1751730	anim-anim	teachers	beside	painters	love	skiing	GSLS_plur_syntactic	The teachers beside the painters love skiing.	0	29718597	73279702	7084827	210137973	1934331	6	8	8	4	6	syntactic	0	0
6734497	anim-anim	actor	that	chefs	like	leaves	GDLS_C_sing_syntactic	The actor that the chefs like leaves.	0	8000768228	14665285	752773	709849832	59706459	4	5	5	4	6	syntactic	0	39
8506800	anim-anim	bakers	beside	farmers	loves	climbing	GDLD_plur_syntactic	The bakers beside the farmers loves climbing.	1	29718597	997597	33753767	12028067	7755370	6	6	7	5	8	syntactic	0	0
5027233	anim-anim	athletes	that	waiter	love	leave	GSLD_C_plur_syntactic	The athletes that the waiter love leave.	1	8000768228	4726603	3340926	210137973	111442661	4	8	6	4	5	syntactic	0	0
1525961	anim-anim	author	by	judge	crashes	noisily	GDLD_sing_semantic	The author by the judge crashes noisily.	1	4703106084	99092074	63704000	1060077	807804	2	6	5	7	7	semantic	0	0
1022657	anim-anim	plumber	that	banker	dislikes	swims	GSLS_C_sing_syntactic	The plumber that the banker dislikes swims.	0	8000768228	734834	5135467	1451937	692721	4	7	6	8	5	syntactic	0	0
3283574	anim-anim	judge	near	lawyers	loves	knitting	GSLD_sing_syntactic	The judge near the lawyers loves knitting.	0	154954539	63704000	15702570	12028067	2033048	4	5	7	5	8	syntactic	0	0
528819	anim-anim	plumbers	that	teachers	admire	turn	GSLS_C_plur_syntactic	The plumbers that the teachers admire turn.	0	8000768228	543869	73279702	6461497	134505772	4	8	8	6	4	syntactic	0	0
1552616	inanim-inanim	cars	near	tractors	dislike	climbing	GDLD_plur_semantic	The cars near the tractors dislike climbing.	1	154954539	24371897	1908544	6703610	7755370	4	4	8	7	8	semantic	0	0
1332647	inanim-inanim	taxi	near	van	brakes	suddenly	GSLS_sing_semantic	The taxi near the van brakes suddenly.	0	154954539	4478068	54213864	2506876	58025537	4	4	3	6	8	semantic	0	0
4317750	anim-anim	farmers	by	judge	admire	gratitude	GSLD_plur_syntactic	The farmers by the judge admire gratitude.	0	4703106084	33753767	63704000	6461497	12072922	2	7	5	6	9	syntactic	0	0
10529329	anim-anim	author	that	waiter	love	moves	GDLD_C_sing_syntactic	The author that the waiter love moves.	1	8000768228	99092074	3340926	210137973	24787121	4	6	6	4	5	syntactic	0	0
9278433	anim-anim	lawyers	that	bankers	knows	swim	GDLD_C_plur_syntactic	The lawyers that the bankers knows swim.	1	8000768228	15702570	6179440	50729807	6237963	4	7	7	5	4	syntactic	0	0
2992369	anim-anim	chef	that	farmers	loves	sneezes	GSLD_C_sing_syntactic	The chef that the farmers loves sneezes.	1	8000768228	2470923	33753767	12028067	134227	4	4	7	5	7	syntactic	0	0
1454978	inanim-anim	taxis	by	authors	dislike	dancing	GDLS_plur_semantic	The taxis by the authors dislike dancing.	1	4703106084	1073931	42845288	6703610	15565681	2	5	7	7	7	semantic	0	0
9284837	anim-anim	doctors	that	bankers	admires	leave	GDLD_C_plur_syntactic	The doctors that the bankers admires leave.	1	8000768228	19521968	6179440	929819	111442661	4	7	7	7	5	syntactic	0	0
4345864	anim-anim	farmer	beside	nurses	dislikes	painting	GSLD_sing_syntactic	The farmer beside the nurses dislikes painting.	0	29718597	20568429	14176931	1451937	32738623	6	6	6	8	8	syntactic	0	0
9082240	anim-anim	chef	near	author	like	climbing	GDLD_sing_syntactic	The chef near the author like climbing.	1	154954539	2470923	99092074	709849832	7755370	4	4	6	4	8	syntactic	0	0
1422551	inanim-anim	scooter	beside	doctor	loves	driving	GDLS_sing_semantic	The scooter beside the doctor loves driving.	1	29718597	405037	52110730	12028067	25592961	6	7	6	5	7	semantic	0	0
5253764	anim-anim	painters	near	vet	dislike	dancing	GSLD_plur_syntactic	The painters near the vet dislike dancing.	0	154954539	7084827	2597895	6703610	15565681	4	8	3	7	7	syntactic	0	0
1331700	inanim-inanim	truck	beside	scooter	smashes	loudly	GSLS_sing_semantic	The truck beside the scooter smashes loudly.	0	29718597	14274010	405037	177467	5998778	6	5	7	7	6	semantic	0	0
9006618	anim-anim	vet	by	actor	hate	hunting	GDLD_sing_syntactic	The vet by the actor hate hunting.	1	4703106084	2597895	14665285	16538862	19801295	2	3	5	4	7	syntactic	0	0
1388325	anim-inanim	actor	near	crane	dislikes	boxing	GSLD_sing_semantic	The actor near the crane dislikes boxing.	0	154954539	14665285	5664326	1451937	2262574	4	5	5	8	6	semantic	0	0
9153707	anim-anim	actor	that	author	admire	prays	GDLD_C_sing_syntactic	The actor that the author admire prays.	1	8000768228	14665285	99092074	6461497	1506735	4	5	6	6	5	syntactic	0	0
1909089	anim-anim	bankers	that	pilots	love	die	GSLS_C_plur_syntactic	The bankers that the pilots love die.	0	8000768228	6179440	5455700	210137973	104147370	4	7	6	4	3	syntactic	0	0
1331889	inanim-inanim	jeeps	near	scooters	smash	noisily	GSLS_plur_semantic	The jeeps near the scooters smash noisily.	0	154954539	406341	182717	1655337	807804	4	5	8	5	7	semantic	0	0
7529167	anim-anim	barber	that	pilots	admire	cries	GDLS_C_sing_syntactic	The barber that the pilots admire cries.	0	8000768228	4668021	5455700	6461497	9051102	4	6	6	6	5	syntactic	0	0
2181674	anim-anim	barbers	by	tailors	dislike	studying	GSLS_plur_syntactic	The barbers by the tailors dislike studying.	0	4703106084	607437	1121681	6703610	19754110	2	7	7	7	8	syntactic	0	0
1334514	inanim-inanim	vans	beside	cranes	skid	abruptly	GSLS_plur_semantic	The vans beside the cranes skid abruptly.	0	29718597	963840	1511645	816187	7262021	6	4	6	4	8	semantic	0	0
138694	anim-anim	baker	by	doctor	likes	shopping	GSLS_sing_syntactic	The baker by the doctor likes shopping.	0	4703106084	13610150	52110730	9285296	11206466	2	5	6	5	8	syntactic	0	0
1354272	anim-inanim	authors	beside	trucks	like	climbing	GSLD_plur_semantic	The authors beside the trucks like climbing.	0	29718597	42845288	6808013	709849832	7755370	6	7	6	4	8	semantic	84	0
1351201	anim-inanim	farmers	by	trucks	like	skiing	GSLD_plur_semantic	The farmers by the trucks like skiing.	0	4703106084	33753767	6808013	709849832	1934331	2	7	6	4	6	semantic	101	0
5823185	anim-anim	plumbers	that	farmer	loves	turn	GDLS_C_plur_syntactic	The plumbers that the farmer loves turn.	0	8000768228	543869	20568429	12028067	134505772	4	8	6	5	4	syntactic	0	0
7314849	anim-anim	barbers	that	painter	loves	leave	GDLS_C_plur_syntactic	The barbers that the painter loves leave.	0	8000768228	607437	13065194	12028067	111442661	4	7	7	5	5	syntactic	0	0
5263281	anim-anim	plumber	that	vets	dislikes	lies	GSLD_C_sing_syntactic	The plumber that the vets dislikes lies.	1	8000768228	734834	262330	1451937	48941300	4	7	4	8	4	syntactic	0	0
1338406	anim-inanim	lawyer	by	bus	likes	walking	GSLD_sing_semantic	The lawyer by the bus likes walking.	0	4703106084	21493788	19370874	9285296	30746983	2	6	3	5	7	semantic	0	0
1179837	anim-anim	author	that	barber	knows	sneezes	GSLS_C_sing_syntactic	The author that the barber knows sneezes.	0	8000768228	99092074	4668021	50729807	134227	4	6	6	5	7	syntactic	0	0
1514932	anim-anim	barber	beside	judge	hates	gambling	GSLS_sing_syntactic	The barber beside the judge hates gambling.	0	29718597	4668021	63704000	2416713	6130169	6	6	5	5	8	syntactic	0	0
8789582	anim-anim	teachers	beside	lawyers	likes	camping	GDLD_plur_syntactic	The teachers beside the lawyers likes camping.	1	29718597	73279702	15702570	9285296	3430548	6	8	7	5	7	syntactic	0	0
5453928	anim-anim	doctor	near	bakers	like	acting	GDLS_sing_syntactic	The doctor near the bakers like acting.	1	154954539	52110730	997597	709849832	38536231	4	6	6	4	6	syntactic	27	0
7309622	anim-anim	bankers	near	painter	dislikes	shopping	GDLS_plur_syntactic	The bankers near the painter dislikes shopping.	1	154954539	6179440	13065194	1451937	11206466	4	7	7	8	8	syntactic	0	0
2985073	anim-anim	bankers	that	farmer	dislike	move	GSLD_C_plur_syntactic	The bankers that the farmer dislike move.	1	8000768228	6179440	20568429	6703610	93962800	4	7	6	7	4	syntactic	0	0
1574136	inanim-inanim	tractor	near	crane	loves	fishing	GDLD_sing_semantic	The tractor near the crane loves fishing.	1	154954539	3282135	5664326	12028067	21745307	4	7	5	5	7	semantic	0	0
7597850	anim-anim	chef	beside	plumbers	dislike	boxing	GDLS_sing_syntactic	The chef beside the plumbers dislike boxing.	1	29718597	2470923	543869	6703610	2262574	6	4	8	7	6	syntactic	0	0
1463153	inanim-anim	jeeps	beside	bankers	like	skating	GDLS_plur_semantic	The jeeps beside the bankers like skating.	1	29718597	406341	6179440	709849832	1784648	6	5	7	4	7	semantic	0	0
1417252	inanim-anim	tractor	near	baker	knows	arabic	GDLS_sing_semantic	The tractor near the baker knows Arabic.	1	154954539	3282135	13610150	50729807	9338211	4	7	5	5	6	semantic	0	0
7285076	anim-anim	teachers	by	painter	dislikes	dancing	GDLS_plur_syntactic	The teachers by the painter dislikes dancing.	1	4703106084	73279702	13065194	1451937	15565681	2	8	7	8	7	syntactic	0	0
1572459	inanim-inanim	taxis	near	cranes	dislike	sailing	GDLD_plur_semantic	The taxis near the cranes dislike sailing.	1	154954539	1073931	1511645	6703610	8731451	4	5	6	7	7	semantic	0	0
