	pair_index	n1	pp	n2	v1	v2/n3/adverb	condition	sentence	violIndex	pp_freq	n1_freq	n2_freq	v1_freq	v2/n3/adverb_freq	pp_nl	n1_nl	n2_nl	v1_nl	v2/n3/adverb_nl	violation_type
2	anim-anim	tailor	near	waiters	like	cycling	GDLS_C_sing_syntactic	The tailor that the waiters like sits.	0	154954539	3371396	1363954	709849832	2334761	4	6	7	4	7	syntactic
6	anim-anim	athlete	beside	farmers	avoid	gambling	GDLS_sing_syntactic	The athlete beside the farmers avoid gambling.	1	29718597	3419291	33753767	60713817	6130169	6	7	7	5	8	syntactic
8	anim-anim	doctor	near	nurses	love	fencing	GDLS_C_sing_syntactic	The doctor that the nurses love arrives.	0	154954539	52110730	14176931	210137973	1887055	4	6	6	4	7	syntactic
7	inanim-anim	trucks	near	waiters	like	hunting	GDLS_plur_semantic	The trucks near the waiters like hunting.	1	154954539	6808013	1363954	709849832	19801295	4	6	7	4	7	semantic
7	inanim-inanim	car	by	scooter	loves	climbing	GDLD_sing_semantic	The car by the scooter loves climbing.	1	4703106084	71566944	405037	12028067	7755370	2	3	7	5	8	semantic
7	anim-anim	plumbers	near	tailor	like	walking	GSLD_plur_syntactic	The plumbers near the tailor like walking.	0	154954539	543869	3371396	709849832	30746983	4	8	6	4	7	syntactic
2	anim-anim	pilot	by	baker	detests	cooking	GSLS_C_sing_syntactic	The pilot that the baker detests dies.	0	4703106084	16262831	13610150	181255	13672366	2	5	5	7	7	syntactic
2	anim-anim	painters	by	builder	avoid	yachting	GSLD_C_plur_syntactic	The painters that the builder avoid sit.	1	4703106084	7084827	4915470	60713817	382785	2	8	7	5	8	syntactic
9	anim-inanim	tailor	by	scooter	hates	yachting	GSLD_sing_semantic	The tailor by the scooter hates yachting.	0	4703106084	3371396	405037	2416713	382785	2	6	7	5	8	semantic
4	anim-anim	doctors	by	pilot	hates	studying	GDLS_plur_syntactic	The doctors by the pilot hates studying.	1	4703106084	19521968	16262831	2416713	19754110	2	7	5	5	8	syntactic
8	anim-anim	baker	by	nurses	fears	fishing	GSLD_sing_syntactic	The baker by the nurses fears fishing.	0	4703106084	13610150	14176931	17721106	21745307	2	5	6	5	7	syntactic
4	anim-anim	banker	near	plumbers	avoids	driving	GSLD_C_sing_syntactic	The banker that the plumbers avoids dies.	1	154954539	5135467	543869	3608938	25592961	4	6	8	6	7	syntactic
1	anim-anim	teachers	by	farmer	fears	yachting	GDLS_plur_syntactic	The teachers by the farmer fears yachting.	1	4703106084	73279702	20568429	17721106	382785	2	8	6	5	8	syntactic
4	anim-anim	builders	near	baker	fears	cooking	GDLS_C_plur_syntactic	The builders that the baker fears die.	0	154954539	5454568	13610150	17721106	13672366	4	8	5	5	7	syntactic
7	anim-anim	tailors	beside	teachers	avoids	hunting	GDLD_plur_syntactic	The tailors beside the teachers avoids hunting.	1	29718597	1121681	73279702	3608938	19801295	6	7	8	6	7	syntactic
6	anim-anim	barber	beside	athlete	hate	spinning	GDLD_C_sing_syntactic	The barber that the athlete hate dies.	1	29718597	4668021	3419291	16538862	6978676	6	6	7	4	8	syntactic
5	inanim-anim	bus	near	banker	rusts	suddenly	GSLD_sing_semantic	The bus near the banker rusts suddenly.	0	154954539	19370874	5135467	219876	58025537	4	3	6	5	8	semantic
5	anim-inanim	teachers	near	cars	rust	suddenly	GDLS_plur_semantic	The teachers near the cars rust suddenly.	1	154954539	73279702	24371897	3598446	58025537	4	8	4	4	8	semantic
6	anim-anim	plumbers	near	bakers	hate	shopping	GSLS_plur_syntactic	The plumbers near the bakers hate shopping.	0	154954539	543869	997597	16538862	11206466	4	8	6	4	8	syntactic
9	anim-inanim	painter	beside	scooter	malfunctions	abruptly	GDLS_sing_semantic	The painter beside the scooter malfunctions abruptly.	1	29718597	13065194	405037	327422	7262021	6	7	7	12	8	semantic
7	inanim-anim	buses	by	judges	leak	suddenly	GSLD_plur_semantic	The buses by the judges leak suddenly.	0	4703106084	4213326	24677643	3272091	58025537	2	5	6	4	8	semantic
9	anim-anim	judges	near	authors	loves	fishing	GDLD_C_plur_syntactic	The judges that the authors loves die.	1	154954539	24677643	42845288	12028067	21745307	4	6	7	5	7	syntactic
0	inanim-anim	truck	by	lawyer	likes	boxing	GDLS_sing_semantic	The truck by the lawyer likes boxing.	1	4703106084	14274010	21493788	9285296	2262574	2	5	6	5	6	semantic
0	anim-anim	judge	by	lawyer	detest	cooking	GDLD_C_sing_syntactic	The judge that the lawyer detest sits.	1	4703106084	63704000	21493788	740903	13672366	2	5	6	6	7	syntactic
1	inanim-inanim	buses	near	tractors	rust	abruptly	GSLS_plur_semantic	The buses near the tractors rust abruptly.	0	154954539	4213326	1908544	3598446	7262021	4	5	8	4	8	semantic
6	anim-anim	actor	beside	baker	loves	spinning	GSLS_sing_syntactic	The actor beside the baker loves spinning.	0	29718597	14665285	13610150	12028067	6978676	6	5	5	5	8	syntactic
1	anim-anim	bankers	beside	painters	like	cycling	GSLS_C_plur_syntactic	The bankers that the painters like die.	0	29718597	6179440	7084827	709849832	2334761	6	7	8	4	7	syntactic
0	anim-anim	builder	near	author	like	acting	GDLD_sing_syntactic	The builder near the author like acting.	1	154954539	4915470	99092074	709849832	38536231	4	7	6	4	6	syntactic
4	anim-anim	nurse	by	banker	dislike	dancing	GDLD_sing_syntactic	The nurse by the banker dislike dancing.	1	4703106084	23875250	5135467	6703610	15565681	2	5	6	7	7	syntactic
0	anim-anim	farmer	beside	athlete	hates	shopping	GSLS_sing_syntactic	The farmer beside the athlete hates shopping.	0	29718597	20568429	3419291	2416713	11206466	6	6	7	5	8	syntactic
4	anim-anim	waiters	by	nurse	dislike	sailing	GSLD_plur_syntactic	The waiters by the nurse dislike sailing.	0	4703106084	1363954	23875250	6703610	8731451	2	7	5	7	7	syntactic
9	anim-anim	dentists	beside	builders	hate	cycling	GSLS_plur_semantic	The dentists beside the builders hate cycling.	0	29718597	1487700	5454568	16538862	2334761	6	8	8	4	7	semantic
4	anim-anim	tailors	beside	builders	fear	climbing	GSLS_C_plur_syntactic	The tailors that the builders fear die.	0	29718597	1121681	5454568	83025936	7755370	6	7	8	4	8	syntactic
8	anim-anim	vets	beside	plumber	dislike	skating	GSLD_C_plur_syntactic	The vets that the plumber dislike die.	1	29718597	262330	734834	6703610	1784648	6	4	7	7	7	syntactic
2	anim-anim	dentist	beside	judges	detest	sailing	GDLS_sing_syntactic	The dentist beside the judges detest sailing.	1	29718597	3198534	24677643	740903	8731451	6	7	6	6	7	syntactic
8	anim-anim	lawyer	by	athletes	hates	yachting	GSLD_C_sing_syntactic	The lawyer that the athletes hates arrives.	1	4703106084	21493788	4726603	2416713	382785	2	6	8	5	8	syntactic
3	anim-anim	waiter	beside	farmers	prefers	bowling	GSLD_sing_syntactic	The waiter beside the farmers prefers bowling.	0	29718597	3340926	33753767	4149558	2476732	6	6	7	7	7	syntactic
2	anim-anim	painters	beside	vets	leak	abruptly	GDLD_plur_semantic	The painters beside the vets leak abruptly.	1	29718597	7084827	262330	3272091	7262021	6	8	4	4	8	semantic
7	anim-anim	painters	near	actors	dislikes	bowling	GDLD_C_plur_syntactic	The painters that the actors dislikes sit.	1	154954539	7084827	18120032	1451937	2476732	4	8	6	8	7	syntactic
7	anim-anim	waiter	by	baker	loves	walking	GSLS_sing_semantic	The waiter by the baker loves walking.	0	4703106084	3340926	13610150	12028067	30746983	2	6	5	5	7	semantic
6	anim-anim	judge	beside	vet	likes	walking	GSLS_C_sing_syntactic	The judge that the vet likes sits.	0	29718597	63704000	2597895	9285296	30746983	6	5	3	5	7	syntactic
6	inanim-inanim	tractors	by	trucks	fear	spinning	GDLD_plur_semantic	The tractors by the trucks fear spinning.	1	4703106084	1908544	6808013	83025936	6978676	2	8	6	4	8	semantic
3	anim-anim	doctors	near	builder	likes	studying	GDLS_C_plur_syntactic	The doctors that the builder likes pray.	0	154954539	19521968	4915470	9285296	19754110	4	7	7	5	8	syntactic
5	inanim-inanim	truck	beside	tractor	rusts	abruptly	GSLS_sing_semantic	The truck beside the tractor rusts abruptly.	0	29718597	14274010	3282135	219876	7262021	6	5	7	5	8	semantic
8	anim-anim	waiters	near	tailors	fear	farming	GSLS_plur_syntactic	The waiters near the tailors fear farming.	0	154954539	1363954	1121681	83025936	15602571	4	7	7	4	7	syntactic
9	anim-inanim	judges	by	taxis	like	fishing	GSLD_plur_semantic	The judges by the taxis like fishing.	0	4703106084	24677643	1073931	709849832	21745307	2	6	5	4	7	semantic
0	anim-anim	teachers	by	lawyers	loves	skating	GDLD_plur_syntactic	The teachers by the lawyers loves skating.	1	4703106084	73279702	15702570	12028067	1784648	2	8	7	5	7	syntactic
9	anim-anim	waiter	near	nurse	malfunctions	suddenly	GDLD_sing_semantic	The waiter near the nurse malfunctions suddenly.	1	154954539	3340926	23875250	327422	58025537	4	6	5	12	8	semantic
