	pair_index	n1	pp	n2	v1	v2/n3/adverb	condition	sentence	violIndex	pp_freq	n1_freq	n2_freq	v1_freq	v2/n3/adverb_freq	pp_nl	n1_nl	n2_nl	v1_nl	v2/n3/adverb_nl	violation_type
0	anim-anim	teacher	near	chef	avoids	boxing	GSLS_sing_syntactic	The teacher near the chef avoids boxing.	0	154954539	74147301	2470923	3608938	2262574	4	7	4	6	6	syntactic
8	anim-anim	doctors	beside	bakers	avoid	cycling	GSLS_plur_semantic	The doctors beside the bakers avoid cycling.	0	29718597	19521968	997597	60713817	2334761	6	7	6	5	7	semantic
2	anim-anim	nurse	near	builders	dislike	acting	GDLS_sing_syntactic	The nurse near the builders dislike acting.	1	154954539	23875250	5454568	6703610	38536231	4	5	8	7	6	syntactic
3	anim-anim	author	near	waiter	honks	noisily	GDLD_sing_semantic	The author near the waiter honks noisily.	1	154954539	99092074	3340926	0	807804	4	6	6	5	7	semantic
7	inanim-inanim	cars	near	vans	honk	noisily	GSLS_plur_semantic	The cars near the vans honk noisily.	0	154954539	24371897	963840	186601	807804	4	4	4	4	7	semantic
2	anim-inanim	baker	by	truck	avoids	hunting	GSLD_sing_semantic	The baker by the truck avoids hunting.	0	4703106084	13610150	14274010	3608938	19801295	2	5	5	6	7	semantic
7	anim-anim	teacher	by	builder	avoid	bowling	GDLD_sing_syntactic	The teacher by the builder avoid bowling.	1	4703106084	74147301	4915470	60713817	2476732	2	7	7	5	7	syntactic
1	anim-anim	builder	by	dentist	dislikes	hunting	GSLS_sing_semantic	The builder by the dentist dislikes hunting.	0	4703106084	4915470	3198534	1451937	19801295	2	7	7	8	7	semantic
5	inanim-anim	bus	by	teacher	hates	skiing	GDLS_sing_semantic	The bus by the teacher hates skiing.	1	4703106084	19370874	74147301	2416713	1934331	2	3	7	5	6	semantic
0	inanim-inanim	bus	by	van	loves	climbing	GDLD_sing_semantic	The bus by the van loves climbing.	1	4703106084	19370874	54213864	12028067	7755370	2	3	3	5	8	semantic
1	anim-inanim	judges	by	scooters	prefer	gambling	GSLD_plur_semantic	The judges by the scooters prefer gambling.	0	4703106084	24677643	182717	20278168	6130169	2	6	8	6	8	semantic
2	anim-anim	builder	near	waiter	detest	cooking	GDLD_sing_syntactic	The builder near the waiter detest cooking.	1	154954539	4915470	3340926	740903	13672366	4	7	6	6	7	syntactic
8	anim-anim	nurse	near	judges	detests	boxing	GSLD_C_sing_syntactic	The nurse that the judges detests arrives.	1	154954539	23875250	24677643	181255	2262574	4	5	6	7	6	syntactic
0	anim-anim	vets	beside	lawyers	like	studying	GSLS_C_plur_syntactic	The vets that the lawyers like sit.	0	29718597	262330	15702570	709849832	19754110	6	4	7	4	8	syntactic
5	anim-anim	waiters	beside	barber	like	painting	GSLD_plur_syntactic	The waiters beside the barber like painting.	0	29718597	1363954	4668021	709849832	32738623	6	7	6	4	8	syntactic
5	anim-anim	actors	beside	plumbers	hates	acting	GDLD_C_plur_syntactic	The actors that the plumbers hates die.	1	29718597	18120032	543869	2416713	38536231	6	6	8	5	6	syntactic
1	anim-anim	author	near	waiter	detests	yachting	GSLS_C_sing_syntactic	The author that the waiter detests prays.	0	154954539	99092074	3340926	181255	382785	4	6	6	7	8	syntactic
8	anim-inanim	vet	near	car	crashes	abruptly	GDLS_sing_semantic	The vet near the car crashes abruptly.	1	154954539	2597895	71566944	1060077	7262021	4	3	3	7	8	semantic
6	inanim-anim	taxi	beside	painter	brakes	suddenly	GSLD_sing_semantic	The taxi beside the painter brakes suddenly.	0	29718597	4478068	13065194	2506876	58025537	6	4	7	6	8	semantic
7	anim-anim	plumbers	near	judge	detests	knitting	GDLS_C_plur_syntactic	The plumbers that the judge detests sit.	0	154954539	543869	63704000	181255	2033048	4	8	5	7	8	syntactic
7	anim-anim	waiter	beside	teachers	hate	bowling	GDLS_C_sing_syntactic	The waiter that the teachers hate prays.	0	29718597	3340926	73279702	16538862	2476732	6	6	8	4	7	syntactic
9	inanim-anim	vans	by	lawyers	leak	abruptly	GSLD_plur_semantic	The vans by the lawyers leak abruptly.	0	4703106084	963840	15702570	3272091	7262021	2	4	7	4	8	semantic
1	anim-anim	pilots	by	chefs	dislikes	painting	GDLD_C_plur_syntactic	The pilots that the chefs dislikes sit.	1	4703106084	5455700	752773	1451937	32738623	2	6	5	8	8	syntactic
2	anim-anim	doctor	near	pilot	likes	sailing	GSLS_sing_syntactic	The doctor near the pilot likes sailing.	0	154954539	52110730	16262831	9285296	8731451	4	6	5	5	7	syntactic
3	anim-anim	teachers	beside	actor	hates	cycling	GDLS_plur_syntactic	The teachers beside the actor hates cycling.	1	29718597	73279702	14665285	2416713	2334761	6	8	5	5	7	syntactic
9	anim-anim	actors	by	bankers	fear	bowling	GSLS_C_plur_syntactic	The actors that the bankers fear sit.	0	4703106084	18120032	6179440	83025936	2476732	2	6	7	4	7	syntactic
1	anim-anim	nurse	beside	bankers	hates	driving	GSLD_sing_syntactic	The nurse beside the bankers hates driving.	0	29718597	23875250	6179440	2416713	25592961	6	5	7	5	7	syntactic
0	inanim-inanim	bus	near	tractor	leaks	abruptly	GSLS_sing_semantic	The bus near the tractor leaks abruptly.	0	154954539	19370874	3282135	1935324	7262021	4	3	7	5	8	semantic
2	anim-anim	baker	near	lawyer	hates	hunting	GSLS_C_sing_syntactic	The baker that the lawyer hates dies.	0	154954539	13610150	21493788	2416713	19801295	4	5	6	5	7	syntactic
3	anim-anim	waiters	by	vets	skid	abruptly	GDLD_plur_semantic	The waiters by the vets skid abruptly.	1	4703106084	1363954	262330	816187	7262021	2	7	4	4	8	semantic
2	anim-anim	bakers	by	nurse	likes	studying	GDLS_plur_syntactic	The bakers by the nurse likes studying.	1	4703106084	997597	23875250	9285296	19754110	2	6	5	5	8	syntactic
9	anim-anim	tailors	by	farmers	fears	skiing	GDLD_plur_syntactic	The tailors by the farmers fears skiing.	1	4703106084	1121681	33753767	17721106	1934331	2	7	7	5	6	syntactic
0	anim-anim	pilot	beside	athletes	fears	hunting	GSLD_C_sing_syntactic	The pilot that the athletes fears prays.	1	29718597	16262831	4726603	17721106	19801295	6	5	8	5	7	syntactic
9	anim-anim	chef	by	judges	love	knitting	GDLS_sing_syntactic	The chef by the judges love knitting.	1	4703106084	2470923	24677643	210137973	2033048	2	4	6	4	8	syntactic
7	anim-anim	doctor	near	painter	dislike	painting	GDLD_C_sing_syntactic	The doctor that the painter dislike dies.	1	154954539	52110730	13065194	6703610	32738623	4	6	7	7	8	syntactic
1	anim-anim	pilots	by	judge	detest	cycling	GSLD_plur_syntactic	The pilots by the judge detest cycling.	0	4703106084	5455700	63704000	740903	2334761	2	6	5	6	7	syntactic
8	anim-anim	bakers	by	tailor	hates	skiing	GDLS_C_plur_syntactic	The bakers that the tailor hates pray.	0	4703106084	997597	3371396	2416713	1934331	2	6	6	5	6	syntactic
5	anim-anim	banker	by	chefs	prefers	skating	GSLD_sing_syntactic	The banker by the chefs prefers skating.	0	4703106084	5135467	752773	4149558	1784648	2	6	5	7	7	syntactic
5	anim-anim	athletes	beside	waiter	detest	shopping	GSLD_C_plur_syntactic	The athletes that the waiter detest pray.	1	29718597	4726603	3340926	740903	11206466	6	8	6	6	8	syntactic
6	anim-anim	pilot	near	banker	fear	climbing	GDLD_C_sing_syntactic	The pilot that the banker fear arrives.	1	154954539	16262831	5135467	83025936	7755370	4	5	6	4	8	syntactic
1	anim-anim	actors	beside	pilot	hate	painting	GSLD_C_plur_syntactic	The actors that the pilot hate sit.	1	29718597	18120032	16262831	16538862	32738623	6	6	5	4	8	syntactic
6	anim-anim	plumbers	by	actors	like	bowling	GSLS_plur_syntactic	The plumbers by the actors like bowling.	0	4703106084	543869	18120032	709849832	2476732	2	8	6	4	7	syntactic
9	anim-inanim	barbers	by	scooters	leak	suddenly	GDLS_plur_semantic	The barbers by the scooters leak suddenly.	1	4703106084	607437	182717	3272091	58025537	2	7	8	4	8	semantic
2	anim-anim	tailors	near	bakers	fear	boxing	GSLS_plur_syntactic	The tailors near the bakers fear boxing.	0	154954539	1121681	997597	83025936	2262574	4	7	6	4	6	syntactic
8	inanim-anim	cars	beside	pilots	dislike	shopping	GDLS_plur_semantic	The cars beside the pilots dislike shopping.	1	29718597	24371897	5455700	6703610	11206466	6	4	6	7	8	semantic
5	anim-anim	waiters	near	chefs	avoids	boxing	GDLD_plur_syntactic	The waiters near the chefs avoids boxing.	1	154954539	1363954	752773	3608938	2262574	4	7	5	6	6	syntactic
6	anim-anim	doctor	near	farmers	avoid	climbing	GDLS_C_sing_syntactic	The doctor that the farmers avoid prays.	0	154954539	52110730	33753767	60713817	7755370	4	6	7	5	8	syntactic
4	inanim-inanim	scooters	near	taxis	like	fencing	GDLD_plur_semantic	The scooters near the taxis like fencing.	1	154954539	182717	1073931	709849832	1887055	4	8	5	4	7	semantic
