	pair_index	n1	pp	n2	v1	v2/n3/adverb	condition	sentence	violIndex	pp_freq	n1_freq	n2_freq	v1_freq	v2/n3/adverb_freq	pp_nl	n1_nl	n2_nl	v1_nl	v2/n3/adverb_nl	violation_type	n1_v1_freq	n2_v1_freq
19250	anim-anim	teacher	beside	baker	loves	skiing	GSLS_sing_syntactic	The teacher beside the baker loves skiing.	0	29718597	74147301	13610150	12028067	1934331	6	7	5	5	6	syntactic	0	0
1338502	anim-inanim	lawyer	beside	bus	loves	walking	GSLD_sing_semantic	The lawyer beside the bus loves walking.	0	29718597	21493788	19370874	12028067	30746983	6	6	3	5	7	semantic	0	0
2385937	anim-anim	athlete	that	vet	likes	prays	GSLS_C_sing_syntactic	The athlete that the vet likes prays.	0	8000768228	3419291	2597895	9285296	1506735	4	7	3	5	5	syntactic	0	0
10060860	anim-anim	waiter	near	painter	hate	bowling	GDLD_sing_syntactic	The waiter near the painter hate bowling.	1	154954539	3340926	13065194	16538862	2476732	4	6	7	4	7	syntactic	0	0
7114850	anim-anim	waiters	by	judge	admires	beauty	GDLS_plur_syntactic	The waiters by the judge admires beauty.	1	4703106084	1363954	63704000	929819	48841623	2	7	5	7	6	syntactic	0	0
1409301	anim-inanim	lawyers	by	vans	smash	noisily	GDLS_plur_semantic	The lawyers by the vans smash noisily.	1	4703106084	15702570	963840	1655337	807804	2	7	4	5	7	semantic	0	0
5800366	anim-anim	nurse	by	farmers	like	camping	GDLS_sing_syntactic	The nurse by the farmers like camping.	1	4703106084	23875250	33753767	709849832	3430548	2	5	7	4	7	syntactic	0	101
1370140	anim-inanim	athletes	beside	scooters	dislike	painting	GSLD_plur_semantic	The athletes beside the scooters dislike painting.	0	29718597	4726603	182717	6703610	32738623	6	8	8	7	8	semantic	0	0
1433414	inanim-anim	taxi	beside	teacher	loves	walking	GDLS_sing_semantic	The taxi beside the teacher loves walking.	1	29718597	4478068	74147301	12028067	30746983	6	4	7	5	7	semantic	0	0
7409921	anim-anim	doctors	that	pilot	likes	smile	GDLS_C_plur_syntactic	The doctors that the pilot likes smile.	0	8000768228	19521968	16262831	9285296	32358171	4	7	5	5	5	syntactic	0	0
4621009	anim-anim	doctors	that	pilot	love	turn	GSLD_C_plur_syntactic	The doctors that the pilot love turn.	1	8000768228	19521968	16262831	210137973	134505772	4	7	5	4	4	syntactic	0	0
432384	anim-anim	actors	near	teachers	love	climbing	GSLS_plur_syntactic	The actors near the teachers love climbing.	0	154954539	18120032	73279702	210137973	7755370	4	6	8	4	8	syntactic	0	0
1429075	inanim-anim	tractors	beside	farmers	like	shopping	GDLS_plur_semantic	The tractors beside the farmers like shopping.	1	29718597	1908544	33753767	709849832	11206466	6	8	7	4	8	semantic	0	101
3328196	anim-anim	vet	by	lawyers	dislikes	cooking	GSLD_sing_syntactic	The vet by the lawyers dislikes cooking.	0	4703106084	2597895	15702570	1451937	13672366	2	3	7	8	7	syntactic	0	0
127967	anim-anim	barbers	that	bakers	admire	lie	GSLS_C_plur_syntactic	The barbers that the bakers admire lie.	0	8000768228	607437	997597	6461497	44672168	4	7	6	6	3	syntactic	0	0
1829904	anim-anim	waiter	beside	painter	dislikes	fishing	GSLS_sing_syntactic	The waiter beside the painter dislikes fishing.	0	29718597	3340926	13065194	1451937	21745307	6	6	7	8	7	syntactic	0	0
7857052	anim-anim	author	by	waiters	love	walking	GDLS_sing_syntactic	The author by the waiters love walking.	1	4703106084	99092074	1363954	210137973	30746983	2	6	7	4	7	syntactic	0	0
7938365	anim-anim	actor	that	waiters	know	sneezes	GDLS_C_sing_syntactic	The actor that the waiters know sneezes.	0	8000768228	14665285	1363954	405542218	134227	4	5	7	4	7	syntactic	0	0
10095649	anim-anim	baker	that	pilot	hate	leaves	GDLD_C_sing_syntactic	The baker that the pilot hate leaves.	1	8000768228	13610150	16262831	16538862	59706459	4	5	5	4	6	syntactic	0	0
4721089	anim-anim	vet	that	pilots	likes	coughs	GSLD_C_sing_syntactic	The vet that the pilots likes coughs.	1	8000768228	2597895	5455700	9285296	582381	4	3	6	5	6	syntactic	0	0
1361350	anim-inanim	authors	near	jeeps	love	walking	GSLD_plur_semantic	The authors near the jeeps love walking.	0	154954539	42845288	406341	210137973	30746983	4	7	5	4	7	semantic	0	0
1329617	inanim-inanim	tractors	near	jeeps	skid	noisily	GSLS_plur_semantic	The tractors near the jeeps skid noisily.	0	154954539	1908544	406341	816187	807804	4	8	5	4	7	semantic	0	0
8619613	anim-anim	plumbers	that	farmers	knows	move	GDLD_C_plur_syntactic	The plumbers that the farmers knows move.	1	8000768228	543869	33753767	50729807	93962800	4	8	7	5	4	syntactic	0	0
1416348	inanim-anim	van	near	baker	loves	painting	GDLS_sing_semantic	The van near the baker loves painting.	1	154954539	54213864	13610150	12028067	32738623	4	3	5	5	8	semantic	0	0
8376540	anim-anim	farmer	beside	doctor	like	bowling	GDLD_sing_syntactic	The farmer beside the doctor like bowling.	1	29718597	20568429	52110730	709849832	2476732	6	6	6	4	7	syntactic	0	27
3640961	anim-anim	doctor	that	bankers	loves	swims	GSLD_C_sing_syntactic	The doctor that the bankers loves swims.	1	8000768228	52110730	6179440	12028067	692721	4	6	7	5	5	syntactic	0	0
1331928	inanim-inanim	tractor	beside	scooter	skids	loudly	GSLS_sing_semantic	The tractor beside the scooter skids loudly.	0	29718597	3282135	405037	250523	5998778	6	7	7	5	6	semantic	0	0
5646801	anim-anim	chefs	that	doctor	loves	turn	GDLS_C_plur_syntactic	The chefs that the doctor loves turn.	0	8000768228	752773	52110730	12028067	134505772	4	5	6	5	4	syntactic	0	0
1348841	anim-inanim	athlete	beside	truck	dislikes	skating	GSLD_sing_semantic	The athlete beside the truck dislikes skating.	0	29718597	3419291	14274010	1451937	1784648	6	7	5	8	7	semantic	0	0
1551210	inanim-inanim	bus	beside	jeep	knows	english	GDLD_sing_semantic	The bus beside the jeep knows English.	1	29718597	19370874	2009598	50729807	195298116	6	3	4	5	7	semantic	0	0
8684020	anim-anim	barbers	near	teachers	dislikes	dancing	GDLD_plur_syntactic	The barbers near the teachers dislikes dancing.	1	154954539	607437	73279702	1451937	15565681	4	7	8	8	7	syntactic	0	0
8712737	anim-anim	painters	that	teachers	likes	die	GDLD_C_plur_syntactic	The painters that the teachers likes die.	1	8000768228	7084827	73279702	9285296	104147370	4	8	8	5	3	syntactic	0	0
3553425	anim-anim	chefs	that	author	love	pray	GSLD_C_plur_syntactic	The chefs that the author love pray.	1	8000768228	752773	99092074	210137973	20289141	4	5	6	4	4	syntactic	0	0
1214512	anim-anim	farmers	by	chefs	like	farming	GSLS_plur_syntactic	The farmers by the chefs like farming.	0	4703106084	33753767	752773	709849832	15602571	2	7	5	4	7	syntactic	101	39
9193472	anim-anim	lawyers	by	bankers	likes	climbing	GDLD_plur_syntactic	The lawyers by the bankers likes climbing.	1	4703106084	15702570	6179440	9285296	7755370	2	7	7	5	8	syntactic	0	0
1326325	inanim-inanim	scooter	near	bus	skids	noisily	GSLS_sing_semantic	The scooter near the bus skids noisily.	0	154954539	405037	19370874	250523	807804	4	7	3	5	7	semantic	0	0
2910994	anim-anim	vets	by	doctor	love	fencing	GSLD_plur_syntactic	The vets by the doctor love fencing.	0	4703106084	262330	52110730	210137973	1887055	2	4	6	4	7	syntactic	0	0
1501208	anim-anim	farmers	by	judges	smash	loudly	GDLD_plur_semantic	The farmers by the judges smash loudly.	1	4703106084	33753767	24677643	1655337	5998778	2	7	6	5	6	semantic	0	0
1561391	inanim-inanim	jeep	near	scooter	dislikes	cycling	GDLD_sing_semantic	The jeep near the scooter dislikes cycling.	1	154954539	2009598	405037	1451937	2334761	4	4	7	8	7	semantic	0	0
1537892	inanim-inanim	scooters	beside	taxis	love	acting	GDLD_plur_semantic	The scooters beside the taxis love acting.	1	29718597	182717	1073931	210137973	38536231	6	8	5	4	6	semantic	0	0
104401	anim-anim	tailors	that	bakers	dislike	turn	GSLS_C_plur_syntactic	The tailors that the bakers dislike turn.	0	8000768228	1121681	997597	6703610	134505772	4	7	6	7	4	syntactic	0	0
4611190	anim-anim	baker	by	pilots	loves	knitting	GSLD_sing_syntactic	The baker by the pilots loves knitting.	0	4703106084	13610150	5455700	12028067	2033048	2	5	6	5	8	syntactic	0	0
6693419	anim-anim	judge	that	barbers	admire	prays	GDLS_C_sing_syntactic	The judge that the barbers admire prays.	0	8000768228	63704000	607437	6461497	1506735	4	5	7	6	5	syntactic	0	0
1489137	anim-anim	lawyer	that	judge	likes	lies	GSLS_C_sing_syntactic	The lawyer that the judge likes lies.	0	8000768228	21493788	63704000	9285296	48941300	4	6	5	5	4	syntactic	0	0
8259185	anim-anim	lawyer	that	baker	dislike	moves	GDLD_C_sing_syntactic	The lawyer that the baker dislike moves.	1	8000768228	21493788	13610150	6703610	24787121	4	6	5	7	5	syntactic	0	0
6957932	anim-anim	vets	by	dentist	hates	walking	GDLS_plur_syntactic	The vets by the dentist hates walking.	1	4703106084	262330	3198534	2416713	30746983	2	4	7	5	7	syntactic	0	0
3566364	anim-anim	judges	near	author	hate	bowling	GSLD_plur_syntactic	The judges near the author hate bowling.	0	154954539	24677643	99092074	16538862	2476732	4	6	6	4	7	syntactic	0	0
1333456	inanim-inanim	tractors	beside	cranes	honk	loudly	GSLS_plur_semantic	The tractors beside the cranes honk loudly.	0	29718597	1908544	1511645	186601	5998778	6	8	6	4	6	semantic	0	0
