	pair_index	n1	pp	n2	v1	v2/n3/adverb	condition	sentence	violIndex	pp_freq	n1_freq	n2_freq	v1_freq	v2/n3/adverb_freq	pp_nl	n1_nl	n2_nl	v1_nl	v2/n3/adverb_nl	violation_type
7	inanim-anim	tractors	beside	waiters	avoid	cooking	GDLS_plur_semantic	The tractors beside the waiters avoid cooking.	1	29718597	1908544	1363954	60713817	13672366	6	8	7	5	7	semantic
2	anim-anim	lawyers	beside	vets	dislike	sailing	GSLS_C_plur_syntactic	The lawyers that the vets dislike arrive.	0	29718597	15702570	262330	6703610	8731451	6	7	4	7	7	syntactic
3	anim-anim	doctors	near	author	avoids	skating	GDLS_C_plur_syntactic	The doctors that the author avoids sit.	0	154954539	19521968	99092074	3608938	1784648	4	7	6	6	7	syntactic
9	anim-anim	painter	beside	athlete	love	walking	GDLD_C_sing_syntactic	The painter that the athlete love prays.	1	29718597	13065194	3419291	210137973	30746983	6	7	7	4	7	syntactic
4	anim-anim	waiter	near	actor	fear	walking	GDLD_sing_syntactic	The waiter near the actor fear walking.	1	154954539	3340926	14665285	83025936	30746983	4	6	5	4	7	syntactic
4	anim-anim	tailors	beside	athletes	hates	acting	GDLD_C_plur_syntactic	The tailors that the athletes hates pray.	1	29718597	1121681	4726603	2416713	38536231	6	7	8	5	6	syntactic
5	inanim-inanim	tractors	beside	taxis	leak	abruptly	GSLS_plur_semantic	The tractors beside the taxis leak abruptly.	0	29718597	1908544	1073931	3272091	7262021	6	8	5	4	8	semantic
2	inanim-anim	taxi	beside	nurse	leaks	suddenly	GSLD_sing_semantic	The taxi beside the nurse leaks suddenly.	0	29718597	4478068	23875250	1935324	58025537	6	4	5	5	8	semantic
3	inanim-anim	buses	by	authors	malfunction	abruptly	GSLD_plur_semantic	The buses by the authors malfunction abruptly.	0	4703106084	4213326	42845288	818548	7262021	2	5	7	11	8	semantic
3	anim-anim	baker	beside	builder	likes	studying	GSLS_sing_syntactic	The baker beside the builder likes studying.	0	29718597	13610150	4915470	9285296	19754110	6	5	7	5	8	syntactic
7	anim-anim	nurse	beside	judge	hate	cycling	GDLD_C_sing_syntactic	The nurse that the judge hate dies.	1	29718597	23875250	63704000	16538862	2334761	6	5	5	4	7	syntactic
2	inanim-inanim	scooter	beside	bus	avoids	sailing	GDLD_sing_semantic	The scooter beside the bus avoids sailing.	1	29718597	405037	19370874	3608938	8731451	6	7	3	6	7	semantic
3	inanim-inanim	scooters	by	cars	fear	bowling	GDLD_plur_semantic	The scooters by the cars fear bowling.	1	4703106084	182717	24371897	83025936	2476732	2	8	4	4	7	semantic
8	anim-anim	authors	beside	chefs	avoid	cycling	GSLS_plur_semantic	The authors beside the chefs avoid cycling.	0	29718597	42845288	752773	60713817	2334761	6	7	5	5	7	semantic
9	anim-anim	dentist	near	lawyers	prefers	climbing	GSLD_C_sing_syntactic	The dentist that the lawyers prefers dies.	1	154954539	3198534	15702570	4149558	7755370	4	7	7	7	8	syntactic
2	anim-anim	dentist	by	plumber	like	boxing	GDLD_sing_syntactic	The dentist by the plumber like boxing.	1	4703106084	3198534	734834	709849832	2262574	2	7	7	4	6	syntactic
6	anim-anim	banker	beside	teacher	fears	spinning	GSLS_sing_syntactic	The banker beside the teacher fears spinning.	0	29718597	5135467	74147301	17721106	6978676	6	6	7	5	8	syntactic
0	anim-anim	tailors	by	painters	prefer	knitting	GSLS_C_plur_syntactic	The tailors that the painters prefer pray.	0	4703106084	1121681	7084827	20278168	2033048	2	7	8	6	8	syntactic
0	anim-anim	lawyer	beside	bankers	likes	studying	GSLD_sing_syntactic	The lawyer beside the bankers likes studying.	0	29718597	21493788	6179440	9285296	19754110	6	6	7	5	8	syntactic
6	anim-anim	vet	near	author	loves	fishing	GSLS_sing_semantic	The vet near the author loves fishing.	0	154954539	2597895	99092074	12028067	21745307	4	3	6	5	7	semantic
2	anim-anim	banker	beside	teacher	dislikes	sailing	GSLS_C_sing_syntactic	The banker that the teacher dislikes sits.	0	29718597	5135467	74147301	1451937	8731451	6	6	7	8	7	syntactic
7	anim-anim	builder	by	tailors	hates	skiing	GSLD_C_sing_syntactic	The builder that the tailors hates dies.	1	4703106084	4915470	1121681	2416713	1934331	2	7	7	5	6	syntactic
7	anim-anim	pilots	near	waiter	avoid	gambling	GSLD_C_plur_syntactic	The pilots that the waiter avoid die.	1	154954539	5455700	3340926	60713817	6130169	4	6	6	5	8	syntactic
5	anim-anim	bakers	by	plumbers	leak	suddenly	GDLD_plur_semantic	The bakers by the plumbers leak suddenly.	1	4703106084	997597	543869	3272091	58025537	2	6	8	4	8	semantic
1	anim-anim	chefs	by	author	loves	fencing	GDLS_plur_syntactic	The chefs by the author loves fencing.	1	4703106084	752773	99092074	12028067	1887055	2	5	6	5	7	syntactic
3	anim-inanim	actors	near	tractors	leak	abruptly	GDLS_plur_semantic	The actors near the tractors leak abruptly.	1	154954539	18120032	1908544	3272091	7262021	4	6	8	4	8	semantic
3	anim-anim	actors	by	dentists	hates	cycling	GDLD_plur_syntactic	The actors by the dentists hates cycling.	1	4703106084	18120032	1487700	2416713	2334761	2	6	8	5	7	syntactic
6	anim-anim	chefs	near	judges	loves	shopping	GDLD_C_plur_syntactic	The chefs that the judges loves die.	1	154954539	752773	24677643	12028067	11206466	4	5	6	5	8	syntactic
5	anim-anim	judges	by	doctor	detests	studying	GDLS_C_plur_syntactic	The judges that the doctor detests sit.	0	4703106084	24677643	52110730	181255	19754110	2	6	6	7	8	syntactic
1	inanim-anim	car	beside	builder	fears	farming	GDLS_sing_semantic	The car beside the builder fears farming.	1	29718597	71566944	4915470	17721106	15602571	6	3	7	5	7	semantic
7	anim-anim	dentist	near	pilot	leaks	suddenly	GDLD_sing_semantic	The dentist near the pilot leaks suddenly.	1	154954539	3198534	16262831	1935324	58025537	4	7	5	5	8	semantic
2	anim-anim	tailor	by	plumbers	like	boxing	GDLS_C_sing_syntactic	The tailor that the plumbers like arrives.	0	4703106084	3371396	543869	709849832	2262574	2	6	8	4	6	syntactic
1	inanim-inanim	van	near	truck	leaks	abruptly	GSLS_sing_semantic	The van near the truck leaks abruptly.	0	154954539	54213864	14274010	1935324	7262021	4	3	5	5	8	semantic
9	anim-inanim	waiter	near	taxi	likes	fencing	GSLD_sing_semantic	The waiter near the taxi likes fencing.	0	154954539	3340926	4478068	9285296	1887055	4	6	4	5	7	semantic
9	anim-anim	tailors	by	nurse	prefer	dancing	GSLD_plur_syntactic	The tailors by the nurse prefer dancing.	0	4703106084	1121681	23875250	20278168	15565681	2	7	5	6	7	syntactic
6	anim-anim	dentists	by	farmers	dislike	farming	GSLS_plur_syntactic	The dentists by the farmers dislike farming.	0	4703106084	1487700	33753767	6703610	15602571	2	8	7	7	7	syntactic
9	anim-anim	waiter	near	judges	prefers	farming	GSLD_sing_syntactic	The waiter near the judges prefers farming.	0	154954539	3340926	24677643	4149558	15602571	4	6	6	7	7	syntactic
0	anim-inanim	tailors	near	buses	detest	shopping	GSLD_plur_semantic	The tailors near the buses detest shopping.	0	154954539	1121681	4213326	740903	11206466	4	7	5	6	8	semantic
6	anim-anim	plumber	near	builders	love	camping	GDLS_sing_syntactic	The plumber near the builders love camping.	1	154954539	734834	5454568	210137973	3430548	4	7	8	4	7	syntactic
9	anim-anim	athletes	near	pilots	detests	skiing	GDLD_plur_syntactic	The athletes near the pilots detests skiing.	1	154954539	4726603	5455700	181255	1934331	4	8	6	7	6	syntactic
7	anim-anim	waiter	near	judges	hate	farming	GDLS_sing_syntactic	The waiter near the judges hate farming.	1	154954539	3340926	24677643	16538862	15602571	4	6	6	4	7	syntactic
3	anim-inanim	dentist	by	car	leaks	suddenly	GDLS_sing_semantic	The dentist by the car leaks suddenly.	1	4703106084	3198534	71566944	1935324	58025537	2	7	3	5	8	semantic
6	anim-anim	actor	near	banker	detests	shopping	GSLS_C_sing_syntactic	The actor that the banker detests dies.	0	154954539	14665285	5135467	181255	11206466	4	5	6	7	8	syntactic
6	anim-anim	painter	beside	dentists	detest	cycling	GDLS_C_sing_syntactic	The painter that the dentists detest dies.	0	29718597	13065194	1487700	740903	2334761	6	7	8	6	7	syntactic
3	anim-anim	bankers	beside	chef	likes	skiing	GDLS_plur_syntactic	The bankers beside the chef likes skiing.	1	29718597	6179440	2470923	9285296	1934331	6	7	4	5	6	syntactic
2	anim-anim	teachers	near	actor	love	farming	GSLD_plur_syntactic	The teachers near the actor love farming.	0	154954539	73279702	14665285	210137973	15602571	4	8	5	4	7	syntactic
2	anim-anim	judges	near	builders	prefer	fishing	GSLS_plur_syntactic	The judges near the builders prefer fishing.	0	154954539	24677643	5454568	20278168	21745307	4	6	8	6	7	syntactic
3	anim-anim	bankers	beside	builder	dislike	skating	GSLD_C_plur_syntactic	The bankers that the builder dislike die.	1	29718597	6179440	4915470	6703610	1784648	6	7	7	7	7	syntactic
