	pair_index	n1	pp	n2	v1	v2/n3/adverb	condition	sentence	violIndex	pp_freq	n1_freq	n2_freq	v1_freq	v2/n3/adverb_freq	pp_nl	n1_nl	n2_nl	v1_nl	v2/n3/adverb_nl	violation_type
7	anim-anim	athlete	beside	painter	like	sailing	GDLD_C_sing_syntactic	The athlete that the painter like prays.	1	29718597	3419291	13065194	709849832	8731451	6	7	7	4	7	syntactic
1	anim-anim	plumber	near	vet	hates	camping	GSLS_sing_syntactic	The plumber near the vet hates camping.	0	154954539	734834	2597895	2416713	3430548	4	7	3	5	7	syntactic
4	anim-anim	pilots	near	judge	love	fencing	GSLD_C_plur_syntactic	The pilots that the judge love arrive.	1	154954539	5455700	63704000	210137973	1887055	4	6	5	4	7	syntactic
6	anim-anim	farmers	near	banker	fear	sailing	GSLD_plur_syntactic	The farmers near the banker fear sailing.	0	154954539	33753767	5135467	83025936	8731451	4	7	6	4	7	syntactic
2	anim-anim	bankers	near	doctors	loves	bowling	GDLD_plur_syntactic	The bankers near the doctors loves bowling.	1	154954539	6179440	19521968	12028067	2476732	4	7	7	5	7	syntactic
0	anim-anim	actors	by	builder	hates	hunting	GDLS_C_plur_syntactic	The actors that the builder hates sit.	0	4703106084	18120032	4915470	2416713	19801295	2	6	7	5	7	syntactic
6	anim-anim	authors	near	plumbers	prefer	gambling	GSLS_C_plur_syntactic	The authors that the plumbers prefer arrive.	0	154954539	42845288	543869	20278168	6130169	4	7	8	6	8	syntactic
9	anim-anim	doctor	by	builders	love	boxing	GDLS_C_sing_syntactic	The doctor that the builders love sits.	0	4703106084	52110730	5454568	210137973	2262574	2	6	8	4	6	syntactic
3	anim-anim	athletes	near	baker	prefers	spinning	GDLS_C_plur_syntactic	The athletes that the baker prefers die.	0	154954539	4726603	13610150	4149558	6978676	4	8	5	7	8	syntactic
4	inanim-anim	scooters	near	plumbers	honk	once	GSLD_plur_semantic	The scooters near the plumbers honk once.	0	154954539	182717	543869	186601	267334111	4	8	8	4	4	semantic
0	anim-anim	barber	near	tailor	prefer	sailing	GDLD_sing_syntactic	The barber near the tailor prefer sailing.	1	154954539	4668021	3371396	20278168	8731451	4	6	6	6	7	syntactic
0	inanim-anim	taxis	by	barbers	fear	fishing	GDLS_plur_semantic	The taxis by the barbers fear fishing.	1	4703106084	1073931	607437	83025936	21745307	2	5	7	4	7	semantic
3	anim-anim	dentist	beside	nurses	hates	driving	GSLD_C_sing_syntactic	The dentist that the nurses hates arrives.	1	29718597	3198534	14176931	2416713	25592961	6	7	6	5	7	syntactic
2	anim-anim	actor	by	farmer	avoids	gambling	GSLS_sing_syntactic	The actor by the farmer avoids gambling.	0	4703106084	14665285	20568429	3608938	6130169	2	5	6	6	8	syntactic
1	anim-inanim	plumber	beside	taxi	honks	twice	GDLS_sing_semantic	The plumber beside the taxi honks twice.	1	29718597	734834	4478068	0	36389658	6	7	4	5	5	semantic
9	anim-anim	nurse	near	doctor	hates	bowling	GSLS_C_sing_syntactic	The nurse that the doctor hates dies.	0	154954539	23875250	52110730	2416713	2476732	4	5	6	5	7	syntactic
7	anim-anim	lawyers	beside	chefs	love	farming	GSLS_plur_semantic	The lawyers beside the chefs love farming.	0	29718597	15702570	752773	210137973	15602571	6	7	5	4	7	semantic
0	anim-anim	plumber	by	doctors	avoids	driving	GSLD_sing_syntactic	The plumber by the doctors avoids driving.	0	4703106084	734834	19521968	3608938	25592961	2	7	7	6	7	syntactic
4	anim-anim	painters	beside	bakers	leak	abruptly	GDLD_plur_semantic	The painters beside the bakers leak abruptly.	1	29718597	7084827	997597	3272091	7262021	6	8	6	4	8	semantic
9	anim-anim	bankers	beside	vet	like	walking	GSLD_plur_syntactic	The bankers beside the vet like walking.	0	29718597	6179440	2597895	709849832	30746983	6	7	3	4	7	syntactic
6	anim-anim	builder	near	teacher	avoid	cycling	GDLD_C_sing_syntactic	The builder that the teacher avoid sits.	1	154954539	4915470	74147301	60713817	2334761	4	7	7	5	7	syntactic
2	anim-anim	judges	beside	teachers	dislike	hunting	GSLS_plur_syntactic	The judges beside the teachers dislike hunting.	0	29718597	24677643	73279702	6703610	19801295	6	6	8	7	7	syntactic
6	anim-inanim	bankers	near	tractors	honk	loudly	GDLS_plur_semantic	The bankers near the tractors honk loudly.	1	154954539	6179440	1908544	186601	5998778	4	7	8	4	6	semantic
6	anim-anim	doctors	near	plumbers	love	dancing	GSLS_plur_syntactic	The doctors near the plumbers love dancing.	0	154954539	19521968	543869	210137973	15565681	4	7	8	4	7	syntactic
6	anim-anim	tailors	near	dentist	hate	knitting	GSLD_C_plur_syntactic	The tailors that the dentist hate die.	1	154954539	1121681	3198534	16538862	2033048	4	7	7	4	8	syntactic
8	anim-inanim	nurses	near	trucks	avoid	shopping	GSLD_plur_semantic	The nurses near the trucks avoid shopping.	0	154954539	14176931	6808013	60713817	11206466	4	6	6	5	8	semantic
0	anim-anim	athletes	near	bakers	avoid	gambling	GSLS_C_plur_syntactic	The athletes that the bakers avoid sit.	0	154954539	4726603	997597	60713817	6130169	4	8	6	5	8	syntactic
6	anim-anim	builder	near	athlete	likes	knitting	GSLS_C_sing_syntactic	The builder that the athlete likes prays.	0	154954539	4915470	3419291	9285296	2033048	4	7	7	5	8	syntactic
0	anim-anim	bankers	near	teachers	detests	acting	GDLD_C_plur_syntactic	The bankers that the teachers detests arrive.	1	154954539	6179440	73279702	181255	38536231	4	7	8	7	6	syntactic
4	inanim-anim	car	near	waiter	detests	farming	GDLS_sing_semantic	The car near the waiter detests farming.	1	154954539	71566944	3340926	181255	15602571	4	3	6	7	7	semantic
4	inanim-anim	scooter	beside	barber	crashes	suddenly	GSLD_sing_semantic	The scooter beside the barber crashes suddenly.	0	29718597	405037	4668021	1060077	58025537	6	7	6	7	8	semantic
1	anim-anim	vets	near	builder	detests	studying	GDLS_plur_syntactic	The vets near the builder detests studying.	1	154954539	262330	4915470	181255	19754110	4	4	7	7	8	syntactic
9	inanim-inanim	van	near	scooter	avoids	dancing	GDLD_sing_semantic	The van near the scooter avoids dancing.	1	154954539	54213864	405037	3608938	15565681	4	3	7	6	7	semantic
4	anim-anim	lawyer	by	authors	likes	walking	GSLD_sing_syntactic	The lawyer by the authors likes walking.	0	4703106084	21493788	42845288	9285296	30746983	2	6	7	5	7	syntactic
7	anim-anim	dentist	by	nurse	skids	noisily	GDLD_sing_semantic	The dentist by the nurse skids noisily.	1	4703106084	3198534	23875250	250523	807804	2	7	5	5	7	semantic
5	inanim-inanim	bus	near	car	brakes	abruptly	GSLS_sing_semantic	The bus near the car brakes abruptly.	0	154954539	19370874	71566944	2506876	7262021	4	3	3	6	8	semantic
3	inanim-inanim	tractors	by	buses	like	sailing	GDLD_plur_semantic	The tractors by the buses like sailing.	1	4703106084	1908544	4213326	709849832	8731451	2	8	5	4	7	semantic
4	anim-anim	lawyer	beside	painters	dislike	hunting	GDLS_sing_syntactic	The lawyer beside the painters dislike hunting.	1	29718597	21493788	7084827	6703610	19801295	6	6	8	7	7	syntactic
9	inanim-inanim	cars	by	taxis	brake	loudly	GSLS_plur_semantic	The cars by the taxis brake loudly.	0	4703106084	24371897	1073931	4685005	5998778	2	4	5	5	6	semantic
3	anim-anim	pilots	near	athletes	dislikes	skiing	GDLD_plur_syntactic	The pilots near the athletes dislikes skiing.	1	154954539	5455700	4726603	1451937	1934331	4	6	8	8	6	syntactic
6	anim-inanim	farmer	beside	van	avoids	cycling	GSLD_sing_semantic	The farmer beside the van avoids cycling.	0	29718597	20568429	54213864	3608938	2334761	6	6	3	6	7	semantic
7	anim-anim	waiter	beside	judges	likes	spinning	GSLD_C_sing_syntactic	The waiter that the judges likes arrives.	1	29718597	3340926	24677643	9285296	6978676	6	6	6	5	8	syntactic
2	anim-anim	barber	by	judge	dislikes	boxing	GSLS_sing_semantic	The barber by the judge dislikes boxing.	0	4703106084	4668021	63704000	1451937	2262574	2	6	5	8	6	semantic
9	anim-anim	barbers	beside	actors	dislikes	boxing	GDLD_C_plur_syntactic	The barbers that the actors dislikes pray.	1	29718597	607437	18120032	1451937	2262574	6	7	6	8	6	syntactic
3	anim-anim	teacher	near	barbers	avoid	farming	GDLS_C_sing_syntactic	The teacher that the barbers avoid dies.	0	154954539	74147301	607437	60713817	15602571	4	7	7	5	7	syntactic
2	anim-anim	builder	near	athletes	avoid	cooking	GDLS_sing_syntactic	The builder near the athletes avoid cooking.	1	154954539	4915470	4726603	60713817	13672366	4	7	8	5	7	syntactic
8	anim-anim	dentist	beside	author	like	driving	GDLD_sing_syntactic	The dentist beside the author like driving.	1	29718597	3198534	99092074	709849832	25592961	6	7	6	4	7	syntactic
8	anim-anim	barbers	near	teacher	loves	fencing	GDLS_plur_syntactic	The barbers near the teacher loves fencing.	1	154954539	607437	74147301	12028067	1887055	4	7	7	5	7	syntactic
