	pair_index	n1	pp	n2	v1	v2/n3/adverb	condition	sentence	violIndex	pp_freq	n1_freq	n2_freq	v1_freq	v2/n3/adverb_freq	pp_nl	n1_nl	n2_nl	v1_nl	v2/n3/adverb_nl	violation_type
1	inanim-inanim	bus	beside	car	hates	camping	GDLD_sing_semantic	The bus beside the car hates camping.	1	29718597	19370874	71566944	2416713	3430548	6	3	3	5	7	semantic
1	inanim-anim	car	by	baker	likes	gambling	GDLS_sing_semantic	The car by the baker likes gambling.	1	4703106084	71566944	13610150	9285296	6130169	2	3	5	5	8	semantic
8	anim-inanim	waiters	beside	cars	brake	loudly	GDLS_plur_semantic	The waiters beside the cars brake loudly.	1	29718597	1363954	24371897	4685005	5998778	6	7	4	5	6	semantic
2	anim-anim	baker	beside	lawyers	loves	cycling	GSLD_sing_syntactic	The baker beside the lawyers loves cycling.	0	29718597	13610150	15702570	12028067	2334761	6	5	7	5	7	syntactic
3	anim-anim	baker	beside	farmers	like	yachting	GDLS_sing_syntactic	The baker beside the farmers like yachting.	1	29718597	13610150	33753767	709849832	382785	6	5	7	4	8	syntactic
1	anim-anim	doctor	by	pilots	fears	fishing	GSLD_sing_syntactic	The doctor by the pilots fears fishing.	0	4703106084	52110730	5455700	17721106	21745307	2	6	6	5	7	syntactic
2	anim-anim	bakers	by	teachers	leak	abruptly	GDLD_plur_semantic	The bakers by the teachers leak abruptly.	1	4703106084	997597	73279702	3272091	7262021	2	6	8	4	8	semantic
0	inanim-inanim	truck	by	taxi	leaks	suddenly	GSLS_sing_semantic	The truck by the taxi leaks suddenly.	0	4703106084	14274010	4478068	1935324	58025537	2	5	4	5	8	semantic
5	anim-anim	vets	near	farmers	avoid	dancing	GSLS_C_plur_syntactic	The vets that the farmers avoid arrive.	0	154954539	262330	33753767	60713817	15565681	4	4	7	5	7	syntactic
6	anim-inanim	actors	by	buses	detest	fishing	GSLD_plur_semantic	The actors by the buses detest fishing.	0	4703106084	18120032	4213326	740903	21745307	2	6	5	6	7	semantic
7	inanim-anim	taxi	near	author	honks	once	GSLD_sing_semantic	The taxi near the author honks once.	0	154954539	4478068	99092074	0	267334111	4	4	6	5	4	semantic
9	anim-anim	waiters	near	vet	prefer	boxing	GSLD_C_plur_syntactic	The waiters that the vet prefer arrive.	1	154954539	1363954	2597895	20278168	2262574	4	7	3	6	6	syntactic
7	anim-anim	waiter	by	banker	brakes	suddenly	GDLD_sing_semantic	The waiter by the banker brakes suddenly.	1	4703106084	3340926	5135467	2506876	58025537	2	6	6	6	8	semantic
5	anim-anim	actor	near	chef	dislikes	climbing	GSLS_C_sing_syntactic	The actor that the chef dislikes sits.	0	154954539	14665285	2470923	1451937	7755370	4	5	4	8	8	syntactic
0	anim-anim	actors	by	teachers	dislike	shopping	GSLS_C_plur_syntactic	The actors that the teachers dislike pray.	0	4703106084	18120032	73279702	6703610	11206466	2	6	8	7	8	syntactic
5	anim-anim	teachers	near	authors	love	fencing	GSLS_plur_syntactic	The teachers near the authors love fencing.	0	154954539	73279702	42845288	210137973	1887055	4	8	7	4	7	syntactic
3	anim-anim	barber	by	painters	prefers	dancing	GSLD_C_sing_syntactic	The barber that the painters prefers dies.	1	4703106084	4668021	7084827	4149558	15565681	2	6	8	7	7	syntactic
6	inanim-inanim	buses	by	taxis	detest	boxing	GDLD_plur_semantic	The buses by the taxis detest boxing.	1	4703106084	4213326	1073931	740903	2262574	2	5	5	6	6	semantic
5	anim-anim	judge	beside	builders	detest	sailing	GDLS_sing_syntactic	The judge beside the builders detest sailing.	1	29718597	63704000	5454568	740903	8731451	6	5	8	6	7	syntactic
2	anim-anim	farmer	near	teachers	avoids	sailing	GSLD_C_sing_syntactic	The farmer that the teachers avoids dies.	1	154954539	20568429	73279702	3608938	8731451	4	6	8	6	7	syntactic
3	anim-anim	author	near	tailors	prefer	acting	GDLS_C_sing_syntactic	The author that the tailors prefer dies.	0	154954539	99092074	1121681	20278168	38536231	4	6	7	6	6	syntactic
5	anim-anim	lawyers	by	tailors	prefers	walking	GDLD_C_plur_syntactic	The lawyers that the tailors prefers die.	1	4703106084	15702570	1121681	4149558	30746983	2	7	7	7	7	syntactic
0	anim-anim	bankers	near	builders	fear	sailing	GSLS_plur_syntactic	The bankers near the builders fear sailing.	0	154954539	6179440	5454568	83025936	8731451	4	7	8	4	7	syntactic
1	anim-anim	bakers	by	dentist	detest	skating	GSLD_plur_syntactic	The bakers by the dentist detest skating.	0	4703106084	997597	3198534	740903	1784648	2	6	7	6	7	syntactic
1	anim-anim	vets	by	plumber	fear	climbing	GSLD_C_plur_syntactic	The vets that the plumber fear pray.	1	4703106084	262330	734834	83025936	7755370	2	4	7	4	8	syntactic
5	anim-anim	farmers	beside	baker	fears	driving	GDLS_C_plur_syntactic	The farmers that the baker fears pray.	0	29718597	33753767	13610150	17721106	25592961	6	7	5	5	7	syntactic
4	anim-anim	pilot	beside	doctors	like	spinning	GDLS_C_sing_syntactic	The pilot that the doctors like dies.	0	29718597	16262831	19521968	709849832	6978676	6	5	7	4	8	syntactic
7	anim-anim	nurse	by	doctor	like	bowling	GDLD_C_sing_syntactic	The nurse that the doctor like dies.	1	4703106084	23875250	52110730	709849832	2476732	2	5	6	4	7	syntactic
4	inanim-anim	tractors	beside	barbers	prefer	knitting	GDLS_plur_semantic	The tractors beside the barbers prefer knitting.	1	29718597	1908544	607437	20278168	2033048	6	8	7	6	8	semantic
1	anim-anim	judges	beside	teacher	dislikes	sailing	GDLS_plur_syntactic	The judges beside the teacher dislikes sailing.	1	29718597	24677643	74147301	1451937	8731451	6	6	7	8	7	syntactic
7	anim-anim	barber	by	waiter	fears	walking	GSLS_sing_semantic	The barber by the waiter fears walking.	0	4703106084	4668021	3340926	17721106	30746983	2	6	6	5	7	semantic
0	anim-anim	barber	by	nurse	prefers	skating	GSLS_C_sing_syntactic	The barber that the nurse prefers dies.	0	4703106084	4668021	23875250	4149558	1784648	2	6	5	7	7	syntactic
9	anim-anim	plumbers	near	actors	likes	yachting	GDLD_C_plur_syntactic	The plumbers that the actors likes sit.	1	154954539	543869	18120032	9285296	382785	4	8	6	5	8	syntactic
8	anim-anim	painters	beside	plumber	prefer	studying	GSLD_plur_syntactic	The painters beside the plumber prefer studying.	0	29718597	7084827	734834	20278168	19754110	6	8	7	6	8	syntactic
8	inanim-anim	cars	by	builders	leak	abruptly	GSLD_plur_semantic	The cars by the builders leak abruptly.	0	4703106084	24371897	5454568	3272091	7262021	2	4	8	4	8	semantic
6	anim-anim	chef	beside	actor	dislike	boxing	GDLD_sing_syntactic	The chef beside the actor dislike boxing.	1	29718597	2470923	14665285	6703610	2262574	6	4	5	7	6	syntactic
3	anim-anim	athletes	beside	plumbers	hates	cooking	GDLD_plur_syntactic	The athletes beside the plumbers hates cooking.	1	29718597	4726603	543869	2416713	13672366	6	8	8	5	7	syntactic
4	anim-anim	pilots	by	actors	loves	cooking	GDLD_plur_syntactic	The pilots by the actors loves cooking.	1	4703106084	5455700	18120032	12028067	13672366	2	6	6	5	7	syntactic
0	anim-anim	baker	by	plumber	detests	hunting	GSLS_sing_syntactic	The baker by the plumber detests hunting.	0	4703106084	13610150	734834	181255	19801295	2	5	7	7	7	syntactic
4	inanim-inanim	trucks	near	vans	leak	abruptly	GSLS_plur_semantic	The trucks near the vans leak abruptly.	0	154954539	6808013	963840	3272091	7262021	4	6	4	4	8	semantic
9	anim-inanim	athlete	beside	taxi	crashes	suddenly	GDLS_sing_semantic	The athlete beside the taxi crashes suddenly.	1	29718597	3419291	4478068	1060077	58025537	6	7	4	7	8	semantic
0	anim-anim	athletes	by	farmers	dislike	shopping	GSLS_plur_semantic	The athletes by the farmers dislike shopping.	0	4703106084	4726603	33753767	6703610	11206466	2	8	7	7	8	semantic
5	anim-anim	tailor	near	chef	hate	driving	GDLD_sing_syntactic	The tailor near the chef hate driving.	1	154954539	3371396	2470923	16538862	25592961	4	6	4	4	7	syntactic
6	anim-anim	barber	near	painter	dislike	fishing	GDLD_C_sing_syntactic	The barber that the painter dislike sits.	1	154954539	4668021	13065194	6703610	21745307	4	6	7	7	7	syntactic
6	anim-anim	painters	beside	doctor	detests	cooking	GDLS_plur_syntactic	The painters beside the doctor detests cooking.	1	29718597	7084827	52110730	181255	13672366	6	8	6	7	7	syntactic
5	anim-inanim	athlete	near	tractor	avoids	boxing	GSLD_sing_semantic	The athlete near the tractor avoids boxing.	0	154954539	3419291	3282135	3608938	2262574	4	7	7	6	6	semantic
4	anim-anim	builder	near	barber	likes	skating	GSLS_sing_syntactic	The builder near the barber likes skating.	0	154954539	4915470	4668021	9285296	1784648	4	7	6	5	7	syntactic
7	anim-anim	lawyers	by	teacher	loves	skiing	GDLS_C_plur_syntactic	The lawyers that the teacher loves arrive.	0	4703106084	15702570	74147301	12028067	1934331	2	7	7	5	6	syntactic
